"title","time"
"Governor signs bills to significantly improve health care access ...","20 days ago"
"Meet Lele, the Giant Mexican Doll Visiting Denver for the Cities ...","2 days ago"
"Medical tourism to Mexico is on the rise, but it can come with risks","Mar 8"
"Mexican households shoulder high proportion of health spending","Dec 29"
"Here's where Biden's 2020 campaign promises currently stand","Yesterday"
"Infographic | How Do Mexicans Get Healthcare?","Oct 7, 2022"
"Medsi Boosts Growth of Mexico’s First “Health Assurance” Super ...","Feb 2"
"Medical Tourism Can Get You Healthcare Bargains Abroad","Mar 23"
"How New Mexico Dramatically Reduced Marketplace Deductibles At ...","Jul 20, 2022"
"Displaced coal miners, power plant workers ask for help with health ...","Nov 17"
"Lightening the load: Costs to drop for those using NM's health care ...","Oct 22, 2022"
"Gulf cartel apologizes after Americans are kidnapped and killed in Mexico","Mar 9"
"Hit with $7146 for two hospital bills, a family sought health care in ...","Apr 27, 2022"
"Paying cash for high health care bills can sometimes cut your costs ...","Aug 23, 2022"
"Retiring in Mexico: What You Need to Know","Dec 8"
"New Mexico to kick COVID vaccines, treatments to the private market","Mar 6"
"Press Briefing by Press Secretary Karine Jean-Pierre","Mar 7"
"Huge Atlantic seaweed bloom threatens beaches in Florida, Mexico","Mar 11"
"Drug war cooperation between the U.S. and Mexico is at its lowest point in decades. What went wrong?","Mar 17"
"3 women missing after traveling from Texas to Mexico","Mar 11"
"Biden inspects US-Mexico border in face of GOP criticism","Jan 9"
"Delays in ETA funding left some laid-off workers ineligible for ...","Feb 28"
"At a New Mexico abortion clinic, calls flood in from Texas and wait ...","Jul 1, 2022"
"What is sargassum? Here's why seaweed is piling up along Florida ...","Mar 15"
"Americans are buying cheaper Ozempic from Canada and Mexico","Mar 29"
"Healthcare: Mexico vs. the United States","Jul 20, 2017"
"Mexican healthcare – the cost and quality","Mar 1, 2022"
"MountainView Regional Medical Center sued over debt collections","Oct 12, 2022"
"New Mexico initiative will lower small business health insurance ...","Jul 14, 2022"
"Behavioral health copays waived for only fraction of New Mexicans","Mar 17, 2022"
"Medical bills left them broke. So they got medical care in Mexico.","May 9, 2022"
"Seguro Popular: Health Coverage For All in Mexico","Feb 26, 2015"
"New Mexico Marijuana Company And Patients Sue For Insurance ...","Jun 14, 2022"
"True Health will pull out of beWellNM health insurance exchange","Apr 25, 2022"
"American Airlines passenger charged after being filmed punching a flight attendant","Sep 23, 2022"
"A Mexican Hospital, an American Surgeon, and a $5000 Check (Yes ...","Aug 9, 2019"
"Flexible Spending Accounts (FSAFEDS) | U.S","Feb 14"
"Gov. Lujan Grisham establishes prescription drug price task force ...","Jun 9, 2022"
"Big promises, few details: the uncertain future of Mexican healthcare ...","Jul 19, 2018"
"Forest Service to shoot wild cattle in New Mexico wilderness from helicopters","Feb 17"
"Healthcare in Mexico: Overview of Costs and Plans Available","Dec 20, 2012"
"New Mexico health insurance marketplace guide 2023 ...","Mar 24, 2021"
"Making It in San Diego: San Diego employers offer health plan in Mexico","Nov 4, 2019"
"Canadian abortion providers can treat Americans if Roe goes away ...","May 4, 2022"
"Health at a Glance 2021","Nov 9, 2021"
"Findings about fatal 'Rust' movie set shooting now with New Mexico prosecutors","Oct 27"
"Mexico’s Discount-Health-Care Problem","Oct 19, 2018"
"HSD makes it easier for low-income seniors to afford Medicare","Jul 12, 2021"
"A Health Insurer’s Latest Plan to Cut Drug Costs? Pay Patients to Visit Mexico","Oct 31, 2018"
"Why I Prefer To Get My Health Care In Latin America","Feb 22, 2018"
"Tyler Perry is helping out an American couple stuck in Mexico with $16K hospital bill","Nov 23, 2019"
"What Country Spends The Most (And Least) On Health Care Per ...","Apr 20, 2017"
"OECD Reviews of Health Systems: Brazil 2021 | en","Dec 14, 2021"
"Medical Tourism Is Booming in Mexico","Jan 9, 2018"
"Introduction of Diagnostic and Supplemental Imaging Legislation Would Benefit Thousands of Mainers","4 hours ago"
"Many insured U.S. Latinos prefer to see doctors in Mexico","May 5, 2014"
"COVID-19: Testing","Dec 26, 2021"
"Will Your Health Insurance Cover You Overseas?","Jul 16, 2019"
"Examining health care in Mexico","Jan 13, 2020"
"U.S. appeals court upholds Trump health care price disclosure rule","Dec 29, 2020"
"Financial protection - Financial protection","May 6, 2021"
"The Best Countries For Expat Healthcare in 2023","Feb 21"
"Health Care in Latin America Compared to the United States","Feb 22, 2018"
"New Mexico Marijuana Company Pushes Insurers To Cover Medical ...","Feb 22, 2022"
"Diabetes In Mexico: An Epidemic And The No. 1 Killer : Goats and ...","Apr 5, 2017"
"Health Coverage and Care of Immigrants","Dec 20"
"AMLO, Mexico’s president, didn’t take coronavirus seriously. A health crisis may be coming.","Mar 28, 2020"
"Mexico will not follow FDA in approving Gilead's COVID-19 drug","Oct 23, 2020"
"Fact check: Mexico never paid for it. But what about Trump's other border wall promises?","Jan 12, 2021"
"Healthcare in Greece: Healthcare Costs, Public Healthcare for ...","Jan 6, 2021"
"Comparing International Health Care Systems","Oct 6, 2009"
"Medical school grad who vanished in Mexico says he 'can't recall anything'","Jun 23, 2019"
"Health at a Glance: Latin America and the Caribbean 2020 | en","Jun 16, 2020"
"Bill Of The Month: Camper's Snakebite Runs Up $143,938 Bill ...","Apr 29, 2019"
"Shopping Abroad For Cheaper Medication? Here’s What You Need To Know","Aug 21, 2019"
"Viagra Prices and How to Buy it Cheaply","Mar 15"
"Drug charity halts patient aid after U.S. health agency pulls approval","Jan 5, 2018"
"Walmart, Home Depot adopt health insurer tactic in drug copay battle","Nov 13, 2018"
"Language barriers, social distancing: Mexico's indigenous face ...","Apr 3, 2020"
"Dozens of Kenyan doctors strike over lack of PPE, delayed pay","Aug 18, 2020"
"LabCorp expands availability of at-home sample collection kit for ...","May 12, 2020"
"Emergency Medical Evacuation Insurance In Travel Insurance Plans","Jul 27, 2022"
"Health insurers says Senate bill's Medicaid cuts to hurt states","Jun 23, 2017"
"Bristol Myers, Bluebird bio set multiple myeloma therapy list price at ...","Mar 29, 2021"
"California woman in semi-comatose state due to mercury poisoning from Mexican skin cream","Sep 12, 2019"
"The makeover of Mexico City – Harvard Gazette","Feb 6, 2015"
"The Ultimate Guide to the Best Mexican Snacks","Sep 17, 2020"
"Japan's fiscal target delay fuels worry about healthcare spending","Jan 23, 2018"
"Analysis: Mexican president's looming election win masks disquiet ...","May 4, 2021"
"Catholic leaders in Mexico move Guadalupe pilgrimage online to ...","Nov 23, 2020"
"Timeline: U.S. healthcare law's technology breakdown","Oct 30, 2013"
"U.S. FDA clears new version of Abbott's low-cost glucose monitor","Jun 15, 2020"
"Dental Work Is So Expensive In The US That Thousands Of Americans Are Going To Mexico To Get It Done","Jun 15, 2017"
"Genetically, There's No Such Thing as a Mexican","Jun 12, 2014"
"Are tough times ahead for countries graduating from foreign aid?","Mar 8, 2018"
"Ten years after the Deepwater Horizon, new spills seem imminent","Apr 24, 2020"
"Retail health clinics should be backup to regular MDs, U.S. doctors say","Oct 12, 2015"
"New Mexico State suspends operations of men’s basketball team","Feb 10"
"'Center of Excellence' may not mean fewer deaths or readmissions","May 20, 2019"
"Biogen to pay $22 million to resolve U.S. drug charity kickback probe","Dec 17, 2020"
